{
  "dimensions": {
    "scope_and_classification": 1,
    "evidence": 2,
    "current_friction": 2,
    "quality_attributes": 2,
    "options": 2,
    "recommendation": 2,
    "migration": 2,
    "verification": 2,
    "generalization": 2
  },
  "total": 17,
  "acceptance_checks": {
    "current_desktop_platform": "Electron desktop (`apps/stage-tamagotchi` uses electron-vite/electron-builder); Git history confirms Tauri was removed/replaced.",
    "runtime_boundaries_identified": [
      "Electron main ↔ renderer/preload Eventa IPC with per-window contexts and specialized window managers.",
      "Electron-main plugin host ↔ dynamically imported extension entrypoints with session, permission, kit, binding, tool, and asset ownership.",
      "Renderer extension UI ↔ sandboxed iframe/window-message Eventa plus cookie-authorized local static-asset HTTP sessions.",
      "Electron main ↔ server-channel WebSocket and local HTTP services.",
      "Electron main ↔ Godot external sidecar process/WebSocket.",
      "Electron main ↔ MCP stdio child-server sessions.",
      "Single-instance Electron process ↔ local runtime resources and fixed localhost services.",
      "Proposed per-plugin Node child-process and independent-daemon boundaries."
    ],
    "legacy_platform_treated_as_current": false
  },
  "factual_errors": [],
  "rationale": "The answer is strongly evidence-backed and actionable, with clear options, trade-offs, recommendation, migration, and verification. Scope loses one point because repository type, confidence, and historical-platform classification are not stated explicitly, although the Electron classification itself is correct. Read-only Git status showed no porcelain changes."
}
