{
  "dimensions": {
    "scope_and_classification": 2,
    "evidence": 2,
    "current_friction": 2,
    "quality_attributes": 2,
    "options": 2,
    "recommendation": 2,
    "migration": 2,
    "verification": 2,
    "generalization": 2
  },
  "total": 18,
  "acceptance_checks": {
    "current_desktop_platform": "Electron (apps/stage-tamagotchi; electron ^41.2.1 via pnpm catalog, plus electron-vite and electron-builder)",
    "runtime_boundaries_identified": [
      "Plugin host runtime: in-process Node dynamic import via FileSystemLoader.loadExtensionFor (packages/plugin-sdk/src/plugin-host/runtimes/node/loaders/fs.ts:72-76); no worker_threads/utilityProcess/new Worker( in apps/stage-tamagotchi/src; the plugin-sdk node-worker transport is a type stub that throws 'not implemented'",
      "Eventa IPC over a single Electron ipcMain without window-namespaced context (setMaxListeners(100) in main/index.ts:58 and setMaxListeners(0) in 15 other files; 'once we refactored eventa' TODO in 16 files)",
      "server-channel WebSocket protocol: extension:authenticate / extension:announce / extension:module:announce handlers in packages/server-runtime/src/index.ts:664-775",
      "Deferred/absent boundaries: plugin process sandbox (utilityProcess/worker_threads), remote plugin transport (local.ts/remote.ts empty shells), standalone background daemon (only a CLI entrypoint exists: packages/server-runtime/src/bin/run.ts)"
    ],
    "legacy_platform_treated_as_current": false
  },
  "factual_errors": [
    {
      "claim": "组合根 settings 依赖 12 项、main 依赖 13 项",
      "repository_evidence": "apps/stage-tamagotchi/src/main/index.ts:216 (settings dependsOn) and :225 (main dependsOn)",
      "explanation": "The settings dependsOn object has 11 keys and the main dependsOn object has 12 keys, so both counts are overstated by one. The qualitative point (large hand-wired DI composition root) still holds."
    },
    {
      "claim": "插件 SDK 深度模块的证据引用 core.ts:205-858",
      "repository_evidence": "packages/plugin-sdk/src/plugin-host/core.ts is 744 lines long",
      "explanation": "The cited range extends past the file's end (744 lines); the described content (ExtensionHost, FileSystemLoader, session/module handling) does live in core.ts around lines ~200-744, so the substance is correct but the line range is invalid."
    }
  ],
  "rationale": "The review is explicit, densely grounded, and actionable across all nine dimensions. It classifies the repo as a pnpm monorepo with an Electron desktop (correct: electron ^41.2.1 in the catalog) and does not mistake the legacy Tauri (crates/) for the current platform. Every load-bearing claim is backed by an accurate path/line citation that I verified — the in-process plugin import, the Eventa setMaxListeners workaround and its 16-file TODO spread, the server-channel extension announce/authenticate protocol plus legacy routing REVIEW comments, the unused permissionResolver hook, the chat window sandbox:false, and the existing reusable/referenced window managers. Friction is framed as root cause vs symptom (missing namespace/lifecycle registry, not missing framework), quality attributes are ranked with explicit trade-offs and per-attribute verification, three genuinely distinct options are compared (status-quo, stabilize-protocol-boundaries, full process-ization), the recommendation follows from the stated drivers, and the migration is incremental with concrete completion criteria and rollback paths. Generalization is clean: the answer explicitly marks fact/inference/unknown and declines to apply Tauri-specific assumptions, keeping project-specific evidence out of core rules. Two minor factual errors (off-by-one DI dependency counts; a core.ts line range exceeding the file length) are recorded but do not undermine the review's conclusions."
}
