{
  "dimensions": {
    "scope_and_classification": 1,
    "evidence": 2,
    "current_friction": 2,
    "quality_attributes": 2,
    "options": 2,
    "recommendation": 2,
    "migration": 2,
    "verification": 2,
    "generalization": 2
  },
  "total": 17,
  "acceptance_checks": {
    "current_desktop_platform": "Electron via apps/stage-tamagotchi; the current tree has no Tauri/crates platform, and Git history records the Tauri/Rust packages being moved out.",
    "runtime_boundaries_identified": [
      "Electron main process ↔ renderer windows through preload/Eventa IPC",
      "Per-window Stage renderer runtime, with Spotlight as the explicit lightweight exception",
      "Electron plugin host ↔ dynamically imported plugin sessions/modules, permissions, capabilities, and bindings",
      "Plugin UI iframe ↔ host renderer, with sandbox and session-scoped static assets",
      "Electron main-owned background managers ↔ Server Channel, MCP stdio processes, and the Godot sidecar",
      "Control plane ↔ data plane, and embedded host ↔ child-process/daemon deployment modes"
    ],
    "legacy_platform_treated_as_current": false
  },
  "factual_errors": [
    {
      "claim": "The stable permission boundary is described as “default deny.”",
      "repository_evidence": "apps/stage-tamagotchi/src/main/services/airi/plugins/host/index.ts:236 constructs ExtensionHost without a permissionResolver; packages/plugin-sdk/src/plugin-host/core.ts:250-258 falls back to manifest permissions when no resolver is supplied. packages/plugin-sdk/docs/design/multi-transport.md:165-167 lists deny-by-default as a next step.",
      "explanation": "Default-deny is a valid recommendation, but it is not the current Electron-host behavior; the answer should label it as a migration target rather than an existing boundary."
    }
  ],
  "rationale": "Decision-ready review with strong repository evidence, viable options, a justified recommendation, and observable reversible migration gates. Scope loses one point because the answer does not explicitly classify the checkout as a monorepo or state confidence. It also overstates default-deny permissions as current rather than proposed."
}
