{
  "dimensions": {
    "scope_and_classification": 2,
    "evidence": 2,
    "current_friction": 2,
    "quality_attributes": 2,
    "options": 2,
    "recommendation": 1,
    "migration": 2,
    "verification": 2,
    "generalization": 2
  },
  "total": 17,
  "acceptance_checks": {
    "current_desktop_platform": "Electron（apps/stage-tamagotchi；Electron main/preload/renderer 与 electron-vite 配置）",
    "runtime_boundaries_identified": [
      "Electron 主进程组合根与 injeca 生命周期",
      "BrowserWindow/WebContents 与 preload/renderer 之间按窗口 Eventa IPC、sender 校验及窗口生命周期",
      "主进程内 ExtensionHost/Plugin SDK 的 manifest、session/module、权限和动态 import 边界",
      "WidgetsWindowManager 管理的插件 widget/iframe 与静态资产 session 边界",
      "主进程内 server channel/HTTP 服务，以及 MCP stdio 和 Godot sidecar 子进程边界",
      "插件控制面与高频数据面的协议边界"
    ],
    "legacy_platform_treated_as_current": false
  },
  "factual_errors": [
    {
      "claim": "把“独立 Plugin Host 进程”描述为适合不可信代码，并把它作为任意第三方/市场插件的最终隔离方向。",
      "repository_evidence": "当前 Electron host 在 apps/stage-tamagotchi/src/main/services/airi/plugins/host/index.ts:236,357 直接使用 ExtensionHost；packages/plugin-sdk/src/plugin-host/runtimes/node/loaders/fs.ts:72-75 直接 import entrypoint。packages/plugin-sdk/docs/design/architecture.md:167-173 只把 external Node process 写成 hot reload/isolation 部署模式；被检查的 host/transport 代码没有 OS sandbox、资源限额或权限 broker。",
      "explanation": "外部进程能提供崩溃/故障域隔离，但普通 Node 子进程仍继承用户级 OS 权限，不能单独兑现“不可信代码”的安全隔离。答案应把 sandbox/broker/resource policy 明确列为另一个必要边界。"
    }
  ],
  "rationale": "答案整体证据充分，准确识别了当前 Electron、主进程内插件动态加载、窗口 Eventa、widget/asset 及后台进程边界，并给出三方案、回滚和可观测迁移验收，因此除推荐方向对“不可信插件”安全性的过度概括外基本满分。Tauri 在仓库文档/Git 历史中是已迁移的历史平台，答案没有把它当作当前桌面平台。"
}
