{
  "dimensions": {
    "scope_and_classification": 2,
    "evidence": 2,
    "current_friction": 2,
    "quality_attributes": 2,
    "options": 2,
    "recommendation": 2,
    "migration": 2,
    "verification": 2,
    "generalization": 2
  },
  "total": 18,
  "acceptance_checks": {
    "current_desktop_platform": "Electron (apps/stage-tamagotchi)",
    "runtime_boundaries_identified": [
      "Electron main process in-process plugin execution — FileSystemLoader.loadExtensionFor uses await import(entrypoint) (packages/plugin-sdk/src/plugin-host/runtimes/node/loaders/fs.ts:74)",
      "Renderer↔main IPC via Eventa contracts under apps/stage-tamagotchi/src/shared/eventa/*",
      "WebSocket server runtime — server-runtime.createServer (default 127.0.0.1:6121) wrapped by channel-server; remote plugin peer via WebSocketExtensionPeer (extension:announce / extension:module:announce / peer:authenticate)",
      "Local loopback HTTP server — http-server createH3Server (random port) + createHttpServerManager serving plugin static assets at /_airi/extensions/** with cookie auth"
    ],
    "legacy_platform_treated_as_current": false
  },
  "factual_errors": [
    {
      "claim": "settingsWindow.dependsOn 已经 13 项、mainWindow 11 项、tray 10 项（并称约 13 个 windows:* provider）",
      "repository_evidence": "apps/stage-tamagotchi/src/main/index.ts:216 (settingsWindow dependsOn = 11 keys), :225 (mainWindow = 12 keys), :240 (tray = 8 keys); windows:* providers at lines 171-246 total 12",
      "explanation": "The dependency counts are miscounted: actual values are settingsWindow 11, mainWindow 12, tray 8, and 12 windows:* providers. The qualitative claim about composition-root bloat still holds, but the specific numbers are inaccurate."
    }
  ],
  "rationale": "The review is exceptionally well-grounded: it correctly scopes the current Electron desktop (apps/stage-tamagotchi), cites paths, symbols, and line numbers that all verify against the checkout, identifies the real frictions (in-process plugin import at fs.ts:74, per-window hand-written setup, two parallel server lifecycles at 6121 vs random H3 port), ranks quality attributes with explicit trade-offs, presents three viable options including status quo, and derives a recommendation (Option B) that follows from the stated drivers. The migration plan is incremental, observable, and reversible with concrete verification commands and tests. Nearly every factual claim was confirmed; the only error is a minor miscount of injeca dependency counts in main/index.ts (recorded above), which does not affect the analysis. No legacy platform is treated as current. Total 18/18."
}
